{
  "fixture_id": "acquisition-identity-001",
  "protocol_id": "HAHAWEEK-EVIDENCE-V4",
  "artifact_type": "ACQUISITION_IDENTITY",
  "domain": "HAHAWEEK-EVIDENCE-V4-ACQUISITION",
  "positive_vectors": [{
    "vector_id": "acquisition-identity-positive-001",
    "input_object": {
      "chain_id": "4663",
      "provider_id": "rpc-primary",
      "request_sequence": "0",
      "pagination_index": "0",
      "requested_from_block": "123",
      "requested_to_block": "132",
      "filter_hash": "0xdddddddddddddddddddddddddddddddddddddddddddddddddddddddddddddddd"
    },
    "canonical_utf8_hex": "7b22636861696e5f6964223a2234363633222c2266696c7465725f68617368223a22307864646464646464646464646464646464646464646464646464646464646464646464646464646464646464646464646464646464646464646464646464222c22706167696e6174696f6e5f696e646578223a2230222c2270726f76696465725f6964223a227270632d7072696d617279222c22726571756573745f73657175656e6365223a2230222c227265717565737465645f66726f6d5f626c6f636b223a22313233222c227265717565737465645f746f5f626c6f636b223a22313332227d",
    "expected_sha256": "74b075d427f5af63d7b2db60e5cf24db200a1cde36db68a2db9494742982aaec",
    "expected_artifact_id": "74b075d427f5af63d7b2db60e5cf24db200a1cde36db68a2db9494742982aaec"
  }],
  "negative_vectors": [{
    "vector_id": "acquisition-identity-negative-001",
    "mutation": {
      "field": "filter_hash",
      "from": "0xdddddddddddddddddddddddddddddddddddddddddddddddddddddddddddddddd",
      "to": "0xeeeeeeeeeeeeeeeeeeeeeeeeeeeeeeeeeeeeeeeeeeeeeeeeeeeeeeeeeeeeeeee"
    },
    "expected_error": "HASH_MISMATCH"
  }]
}
